id,user_query,job_role,company,location,interview_round,mock_question,text,__text__
1472,I have an interview for ML Engineer at Reddit in Chicago — what mock questions should I expect?,ML Engineer,Reddit,Chicago,Behavioral/HR,Describe a time you failed and what you learned.,I have an interview for ML Engineer at Reddit in Chicago — what mock questions should I expect? ||| ML Engineer ||| Reddit ||| Chicago ||| Describe a time you failed and what you learned.,I have an interview for ML Engineer at Reddit in Chicago — what mock questions should I expect? ||| ML Engineer ||| Reddit ||| Chicago ||| Describe a time you failed and what you learned.
1807,Help me practice for QA Engineer interviews at Google located in Austin.,QA Engineer,Google,Austin,ML Case Study,How would you detect data drift and trigger model retraining?,Help me practice for QA Engineer interviews at Google located in Austin. ||| QA Engineer ||| Google ||| Austin ||| How would you detect data drift and trigger model retraining?,Help me practice for QA Engineer interviews at Google located in Austin. ||| QA Engineer ||| Google ||| Austin ||| How would you detect data drift and trigger model retraining?
380,Help me practice for Software Engineer interviews at Microsoft located in Vancouver.,Software Engineer,Microsoft,Vancouver,OA,Count islands in a binary matrix using DFS/BFS.,Help me practice for Software Engineer interviews at Microsoft located in Vancouver. ||| Software Engineer ||| Microsoft ||| Vancouver ||| Count islands in a binary matrix using DFS/BFS.,Help me practice for Software Engineer interviews at Microsoft located in Vancouver. ||| Software Engineer ||| Microsoft ||| Vancouver ||| Count islands in a binary matrix using DFS/BFS.
359,Help me practice for Data Engineer interviews at LinkedIn located in Bangalore.,Data Engineer,LinkedIn,Bangalore,OA,Compute running median from a data stream.,Help me practice for Data Engineer interviews at LinkedIn located in Bangalore. ||| Data Engineer ||| LinkedIn ||| Bangalore ||| Compute running median from a data stream.,Help me practice for Data Engineer interviews at LinkedIn located in Bangalore. ||| Data Engineer ||| LinkedIn ||| Bangalore ||| Compute running median from a data stream.
983,I have an interview for Software Engineer at Dropbox in Sydney — what mock questions should I expect?,Software Engineer,Dropbox,Sydney,System Design,Design a real-time ride-hailing dispatch system.,I have an interview for Software Engineer at Dropbox in Sydney — what mock questions should I expect? ||| Software Engineer ||| Dropbox ||| Sydney ||| Design a real-time ride-hailing dispatch system.,I have an interview for Software Engineer at Dropbox in Sydney — what mock questions should I expect? ||| Software Engineer ||| Dropbox ||| Sydney ||| Design a real-time ride-hailing dispatch system.
903,I'm preparing for a Software Engineer interview at Microsoft in Vancouver. Can you give mock questions?,Software Engineer,Microsoft,Vancouver,System Design,Design a real-time ride-hailing dispatch system.,I'm preparing for a Software Engineer interview at Microsoft in Vancouver. Can you give mock questions? ||| Software Engineer ||| Microsoft ||| Vancouver ||| Design a real-time ride-hailing dispatch system.,I'm preparing for a Software Engineer interview at Microsoft in Vancouver. Can you give mock questions? ||| Software Engineer ||| Microsoft ||| Vancouver ||| Design a real-time ride-hailing dispatch system.
804,Give me common interview problems for Data Engineer roles at Microsoft in LA.,Data Engineer,Microsoft,LA,System Design,Design a monitoring/alerting system for microservices.,Give me common interview problems for Data Engineer roles at Microsoft in LA. ||| Data Engineer ||| Microsoft ||| LA ||| Design a monitoring/alerting system for microservices.,Give me common interview problems for Data Engineer roles at Microsoft in LA. ||| Data Engineer ||| Microsoft ||| LA ||| Design a monitoring/alerting system for microservices.
711,Help me practice for Software Engineer interviews at Apple located in Munich.,Software Engineer,Apple,Munich,Technical,Serialize and deserialize a binary tree.,Help me practice for Software Engineer interviews at Apple located in Munich. ||| Software Engineer ||| Apple ||| Munich ||| Serialize and deserialize a binary tree.,Help me practice for Software Engineer interviews at Apple located in Munich. ||| Software Engineer ||| Apple ||| Munich ||| Serialize and deserialize a binary tree.
1263,What should I study for a Product Manager position at Intuit (location: Seattle)?,Product Manager,Intuit,Seattle,Behavioral/HR,Describe a conflict with a teammate and how you resolved it.,What should I study for a Product Manager position at Intuit (location: Seattle)? ||| Product Manager ||| Intuit ||| Seattle ||| Describe a conflict with a teammate and how you resolved it.,What should I study for a Product Manager position at Intuit (location: Seattle)? ||| Product Manager ||| Intuit ||| Seattle ||| Describe a conflict with a teammate and how you resolved it.
1048,Give me common interview problems for Data Engineer roles at Stripe in NYC.,Data Engineer,Stripe,NYC,System Design,Design a messaging queue with at-least-once delivery.,Give me common interview problems for Data Engineer roles at Stripe in NYC. ||| Data Engineer ||| Stripe ||| NYC ||| Design a messaging queue with at-least-once delivery.,Give me common interview problems for Data Engineer roles at Stripe in NYC. ||| Data Engineer ||| Stripe ||| NYC ||| Design a messaging queue with at-least-once delivery.
394,What should I study for a Data Scientist position at Stripe (location: Singapore)?,Data Scientist,Stripe,Singapore,OA,Count islands in a binary matrix using DFS/BFS.,What should I study for a Data Scientist position at Stripe (location: Singapore)? ||| Data Scientist ||| Stripe ||| Singapore ||| Count islands in a binary matrix using DFS/BFS.,What should I study for a Data Scientist position at Stripe (location: Singapore)? ||| Data Scientist ||| Stripe ||| Singapore ||| Count islands in a binary matrix using DFS/BFS.
587,Give me common interview problems for QA Engineer roles at Meta in Boston.,QA Engineer,Meta,Boston,Technical,"Given intervals, merge overlapping ones.","Give me common interview problems for QA Engineer roles at Meta in Boston. ||| QA Engineer ||| Meta ||| Boston ||| Given intervals, merge overlapping ones.","Give me common interview problems for QA Engineer roles at Meta in Boston. ||| QA Engineer ||| Meta ||| Boston ||| Given intervals, merge overlapping ones."
602,I have an interview for Frontend Engineer at Pinterest in Melbourne — what mock questions should I expect?,Frontend Engineer,Pinterest,Melbourne,Technical,Find the longest consecutive sequence length.,I have an interview for Frontend Engineer at Pinterest in Melbourne — what mock questions should I expect? ||| Frontend Engineer ||| Pinterest ||| Melbourne ||| Find the longest consecutive sequence length.,I have an interview for Frontend Engineer at Pinterest in Melbourne — what mock questions should I expect? ||| Frontend Engineer ||| Pinterest ||| Melbourne ||| Find the longest consecutive sequence length.
310,I'm preparing for a Frontend Engineer interview at Salesforce in NYC. Can you give mock questions?,Frontend Engineer,Salesforce,NYC,OA,"Given a string, return length of longest substring without repeating characters.","I'm preparing for a Frontend Engineer interview at Salesforce in NYC. Can you give mock questions? ||| Frontend Engineer ||| Salesforce ||| NYC ||| Given a string, return length of longest substring without repeating characters.","I'm preparing for a Frontend Engineer interview at Salesforce in NYC. Can you give mock questions? ||| Frontend Engineer ||| Salesforce ||| NYC ||| Given a string, return length of longest substring without repeating characters."
1774,I have an interview for Backend Engineer at Stripe in London — what mock questions should I expect?,Backend Engineer,Stripe,London,ML Case Study,Design an offline/online training pipeline for user embeddings.,I have an interview for Backend Engineer at Stripe in London — what mock questions should I expect? ||| Backend Engineer ||| Stripe ||| London ||| Design an offline/online training pipeline for user embeddings.,I have an interview for Backend Engineer at Stripe in London — what mock questions should I expect? ||| Backend Engineer ||| Stripe ||| London ||| Design an offline/online training pipeline for user embeddings.
219,I have an interview for Software Engineer at Google in Berlin — what mock questions should I expect?,Software Engineer,Google,Berlin,OA,Compute running median from a data stream.,I have an interview for Software Engineer at Google in Berlin — what mock questions should I expect? ||| Software Engineer ||| Google ||| Berlin ||| Compute running median from a data stream.,I have an interview for Software Engineer at Google in Berlin — what mock questions should I expect? ||| Software Engineer ||| Google ||| Berlin ||| Compute running median from a data stream.
1782,Give me common interview problems for Frontend Engineer roles at LinkedIn in Austin.,Frontend Engineer,LinkedIn,Austin,ML Case Study,Design an offline/online training pipeline for user embeddings.,Give me common interview problems for Frontend Engineer roles at LinkedIn in Austin. ||| Frontend Engineer ||| LinkedIn ||| Austin ||| Design an offline/online training pipeline for user embeddings.,Give me common interview problems for Frontend Engineer roles at LinkedIn in Austin. ||| Frontend Engineer ||| LinkedIn ||| Austin ||| Design an offline/online training pipeline for user embeddings.
779,Give me common interview problems for Backend Engineer roles at Reddit in Seattle.,Backend Engineer,Reddit,Seattle,Technical,Top-K frequent elements using a heap.,Give me common interview problems for Backend Engineer roles at Reddit in Seattle. ||| Backend Engineer ||| Reddit ||| Seattle ||| Top-K frequent elements using a heap.,Give me common interview problems for Backend Engineer roles at Reddit in Seattle. ||| Backend Engineer ||| Reddit ||| Seattle ||| Top-K frequent elements using a heap.
1485,I have an interview for Security Engineer at Apple in Munich — what mock questions should I expect?,Security Engineer,Apple,Munich,Behavioral/HR,Tell me about a time you handled an ambiguous requirement.,I have an interview for Security Engineer at Apple in Munich — what mock questions should I expect? ||| Security Engineer ||| Apple ||| Munich ||| Tell me about a time you handled an ambiguous requirement.,I have an interview for Security Engineer at Apple in Munich — what mock questions should I expect? ||| Security Engineer ||| Apple ||| Munich ||| Tell me about a time you handled an ambiguous requirement.
1156,I have an interview for Software Engineer at Twitter in NYC — what mock questions should I expect?,Software Engineer,Twitter,NYC,System Design,Design a monitoring/alerting system for microservices.,I have an interview for Software Engineer at Twitter in NYC — what mock questions should I expect? ||| Software Engineer ||| Twitter ||| NYC ||| Design a monitoring/alerting system for microservices.,I have an interview for Software Engineer at Twitter in NYC — what mock questions should I expect? ||| Software Engineer ||| Twitter ||| NYC ||| Design a monitoring/alerting system for microservices.
1407,Help me practice for Data Scientist interviews at Reddit located in Chicago.,Data Scientist,Reddit,Chicago,Behavioral/HR,Tell me about a project where you had to learn something quickly.,Help me practice for Data Scientist interviews at Reddit located in Chicago. ||| Data Scientist ||| Reddit ||| Chicago ||| Tell me about a project where you had to learn something quickly.,Help me practice for Data Scientist interviews at Reddit located in Chicago. ||| Data Scientist ||| Reddit ||| Chicago ||| Tell me about a project where you had to learn something quickly.
768,Give me common interview problems for Frontend Engineer roles at Microsoft in Paris.,Frontend Engineer,Microsoft,Paris,Technical,Find the longest consecutive sequence length.,Give me common interview problems for Frontend Engineer roles at Microsoft in Paris. ||| Frontend Engineer ||| Microsoft ||| Paris ||| Find the longest consecutive sequence length.,Give me common interview problems for Frontend Engineer roles at Microsoft in Paris. ||| Frontend Engineer ||| Microsoft ||| Paris ||| Find the longest consecutive sequence length.
1240,I have an interview for QA Engineer at Dropbox in Toronto — what mock questions should I expect?,QA Engineer,Dropbox,Toronto,Behavioral/HR,Describe a time you failed and what you learned.,I have an interview for QA Engineer at Dropbox in Toronto — what mock questions should I expect? ||| QA Engineer ||| Dropbox ||| Toronto ||| Describe a time you failed and what you learned.,I have an interview for QA Engineer at Dropbox in Toronto — what mock questions should I expect? ||| QA Engineer ||| Dropbox ||| Toronto ||| Describe a time you failed and what you learned.
82,Give me common interview problems for Backend Engineer roles at Uber in Vancouver.,Backend Engineer,Uber,Vancouver,OA,"Given a string, return length of longest substring without repeating characters.","Give me common interview problems for Backend Engineer roles at Uber in Vancouver. ||| Backend Engineer ||| Uber ||| Vancouver ||| Given a string, return length of longest substring without repeating characters.","Give me common interview problems for Backend Engineer roles at Uber in Vancouver. ||| Backend Engineer ||| Uber ||| Vancouver ||| Given a string, return length of longest substring without repeating characters."
1750,What should I study for a Software Engineer position at Dropbox (location: Hyderabad)?,Software Engineer,Dropbox,Hyderabad,ML Case Study,Design an offline/online training pipeline for user embeddings.,What should I study for a Software Engineer position at Dropbox (location: Hyderabad)? ||| Software Engineer ||| Dropbox ||| Hyderabad ||| Design an offline/online training pipeline for user embeddings.,What should I study for a Software Engineer position at Dropbox (location: Hyderabad)? ||| Software Engineer ||| Dropbox ||| Hyderabad ||| Design an offline/online training pipeline for user embeddings.
1351,I'm preparing for a SRE interview at NVIDIA in Seattle. Can you give mock questions?,SRE,NVIDIA,Seattle,Behavioral/HR,Tell me about a time you handled an ambiguous requirement.,I'm preparing for a SRE interview at NVIDIA in Seattle. Can you give mock questions? ||| SRE ||| NVIDIA ||| Seattle ||| Tell me about a time you handled an ambiguous requirement.,I'm preparing for a SRE interview at NVIDIA in Seattle. Can you give mock questions? ||| SRE ||| NVIDIA ||| Seattle ||| Tell me about a time you handled an ambiguous requirement.
488,What should I study for a Software Engineer position at Apple (location: Dublin)?,Software Engineer,Apple,Dublin,Technical,Serialize and deserialize a binary tree.,What should I study for a Software Engineer position at Apple (location: Dublin)? ||| Software Engineer ||| Apple ||| Dublin ||| Serialize and deserialize a binary tree.,What should I study for a Software Engineer position at Apple (location: Dublin)? ||| Software Engineer ||| Apple ||| Dublin ||| Serialize and deserialize a binary tree.
1771,Give me common interview problems for Backend Engineer roles at Dropbox in Melbourne.,Backend Engineer,Dropbox,Melbourne,ML Case Study,Design an offline/online training pipeline for user embeddings.,Give me common interview problems for Backend Engineer roles at Dropbox in Melbourne. ||| Backend Engineer ||| Dropbox ||| Melbourne ||| Design an offline/online training pipeline for user embeddings.,Give me common interview problems for Backend Engineer roles at Dropbox in Melbourne. ||| Backend Engineer ||| Dropbox ||| Melbourne ||| Design an offline/online training pipeline for user embeddings.
561,I have an interview for SRE at Shopify in Hyderabad — what mock questions should I expect?,SRE,Shopify,Hyderabad,Technical,Implement union-find with path compression.,I have an interview for SRE at Shopify in Hyderabad — what mock questions should I expect? ||| SRE ||| Shopify ||| Hyderabad ||| Implement union-find with path compression.,I have an interview for SRE at Shopify in Hyderabad — what mock questions should I expect? ||| SRE ||| Shopify ||| Hyderabad ||| Implement union-find with path compression.
200,What should I study for a Software Engineer position at Netflix (location: Hyderabad)?,Software Engineer,Netflix,Hyderabad,OA,"Given a string, return length of longest substring without repeating characters.","What should I study for a Software Engineer position at Netflix (location: Hyderabad)? ||| Software Engineer ||| Netflix ||| Hyderabad ||| Given a string, return length of longest substring without repeating characters.","What should I study for a Software Engineer position at Netflix (location: Hyderabad)? ||| Software Engineer ||| Netflix ||| Hyderabad ||| Given a string, return length of longest substring without repeating characters."
691,I'm preparing for a Data Engineer interview at Stripe in London. Can you give mock questions?,Data Engineer,Stripe,London,Technical,Serialize and deserialize a binary tree.,I'm preparing for a Data Engineer interview at Stripe in London. Can you give mock questions? ||| Data Engineer ||| Stripe ||| London ||| Serialize and deserialize a binary tree.,I'm preparing for a Data Engineer interview at Stripe in London. Can you give mock questions? ||| Data Engineer ||| Stripe ||| London ||| Serialize and deserialize a binary tree.
872,Help me practice for Product Manager interviews at Uber located in Hyderabad.,Product Manager,Uber,Hyderabad,System Design,Design a messaging queue with at-least-once delivery.,Help me practice for Product Manager interviews at Uber located in Hyderabad. ||| Product Manager ||| Uber ||| Hyderabad ||| Design a messaging queue with at-least-once delivery.,Help me practice for Product Manager interviews at Uber located in Hyderabad. ||| Product Manager ||| Uber ||| Hyderabad ||| Design a messaging queue with at-least-once delivery.
906,Give me common interview problems for QA Engineer roles at Snap in Remote.,QA Engineer,Snap,Remote,System Design,Design logging ingestion at 10M events/sec.,Give me common interview problems for QA Engineer roles at Snap in Remote. ||| QA Engineer ||| Snap ||| Remote ||| Design logging ingestion at 10M events/sec.,Give me common interview problems for QA Engineer roles at Snap in Remote. ||| QA Engineer ||| Snap ||| Remote ||| Design logging ingestion at 10M events/sec.
1943,I'm preparing for a Product Manager interview at Stripe in Bangalore. Can you give mock questions?,Product Manager,Stripe,Bangalore,ML Case Study,How would you detect data drift and trigger model retraining?,I'm preparing for a Product Manager interview at Stripe in Bangalore. Can you give mock questions? ||| Product Manager ||| Stripe ||| Bangalore ||| How would you detect data drift and trigger model retraining?,I'm preparing for a Product Manager interview at Stripe in Bangalore. Can you give mock questions? ||| Product Manager ||| Stripe ||| Bangalore ||| How would you detect data drift and trigger model retraining?
743,What should I study for a SRE position at NVIDIA (location: LA)?,SRE,NVIDIA,LA,Technical,Implement Dijkstra's algorithm for sparse graphs.,What should I study for a SRE position at NVIDIA (location: LA)? ||| SRE ||| NVIDIA ||| LA ||| Implement Dijkstra's algorithm for sparse graphs.,What should I study for a SRE position at NVIDIA (location: LA)? ||| SRE ||| NVIDIA ||| LA ||| Implement Dijkstra's algorithm for sparse graphs.
730,I have an interview for Software Engineer at Stripe in Remote — what mock questions should I expect?,Software Engineer,Stripe,Remote,Technical,"Given intervals, merge overlapping ones.","I have an interview for Software Engineer at Stripe in Remote — what mock questions should I expect? ||| Software Engineer ||| Stripe ||| Remote ||| Given intervals, merge overlapping ones.","I have an interview for Software Engineer at Stripe in Remote — what mock questions should I expect? ||| Software Engineer ||| Stripe ||| Remote ||| Given intervals, merge overlapping ones."
1627,I have an interview for ML Engineer at Microsoft in Remote — what mock questions should I expect?,ML Engineer,Microsoft,Remote,ML Case Study,Propose an evaluation plan for a recommendation model with cold-start users.,I have an interview for ML Engineer at Microsoft in Remote — what mock questions should I expect? ||| ML Engineer ||| Microsoft ||| Remote ||| Propose an evaluation plan for a recommendation model with cold-start users.,I have an interview for ML Engineer at Microsoft in Remote — what mock questions should I expect? ||| ML Engineer ||| Microsoft ||| Remote ||| Propose an evaluation plan for a recommendation model with cold-start users.
943,I have an interview for Data Engineer at Pinterest in London — what mock questions should I expect?,Data Engineer,Pinterest,London,System Design,Design a real-time ride-hailing dispatch system.,I have an interview for Data Engineer at Pinterest in London — what mock questions should I expect? ||| Data Engineer ||| Pinterest ||| London ||| Design a real-time ride-hailing dispatch system.,I have an interview for Data Engineer at Pinterest in London — what mock questions should I expect? ||| Data Engineer ||| Pinterest ||| London ||| Design a real-time ride-hailing dispatch system.
1962,Help me practice for Data Scientist interviews at LinkedIn located in Berlin.,Data Scientist,LinkedIn,Berlin,ML Case Study,How to measure fairness and bias in a loan prediction model?,Help me practice for Data Scientist interviews at LinkedIn located in Berlin. ||| Data Scientist ||| LinkedIn ||| Berlin ||| How to measure fairness and bias in a loan prediction model?,Help me practice for Data Scientist interviews at LinkedIn located in Berlin. ||| Data Scientist ||| LinkedIn ||| Berlin ||| How to measure fairness and bias in a loan prediction model?
507,Help me practice for Frontend Engineer interviews at Snap located in Melbourne.,Frontend Engineer,Snap,Melbourne,Technical,Serialize and deserialize a binary tree.,Help me practice for Frontend Engineer interviews at Snap located in Melbourne. ||| Frontend Engineer ||| Snap ||| Melbourne ||| Serialize and deserialize a binary tree.,Help me practice for Frontend Engineer interviews at Snap located in Melbourne. ||| Frontend Engineer ||| Snap ||| Melbourne ||| Serialize and deserialize a binary tree.
1842,Help me practice for Data Scientist interviews at Dropbox located in Boston.,Data Scientist,Dropbox,Boston,ML Case Study,How would you detect data drift and trigger model retraining?,Help me practice for Data Scientist interviews at Dropbox located in Boston. ||| Data Scientist ||| Dropbox ||| Boston ||| How would you detect data drift and trigger model retraining?,Help me practice for Data Scientist interviews at Dropbox located in Boston. ||| Data Scientist ||| Dropbox ||| Boston ||| How would you detect data drift and trigger model retraining?
343,I'm preparing for a Product Manager interview at Twitter in Bay Area. Can you give mock questions?,Product Manager,Twitter,Bay Area,OA,Implement two-sum with optimal complexity.,I'm preparing for a Product Manager interview at Twitter in Bay Area. Can you give mock questions? ||| Product Manager ||| Twitter ||| Bay Area ||| Implement two-sum with optimal complexity.,I'm preparing for a Product Manager interview at Twitter in Bay Area. Can you give mock questions? ||| Product Manager ||| Twitter ||| Bay Area ||| Implement two-sum with optimal complexity.
450,Give me common interview problems for Security Engineer roles at Adobe in Vancouver.,Security Engineer,Adobe,Vancouver,Technical,Design a rate limiter supporting sliding window semantics.,Give me common interview problems for Security Engineer roles at Adobe in Vancouver. ||| Security Engineer ||| Adobe ||| Vancouver ||| Design a rate limiter supporting sliding window semantics.,Give me common interview problems for Security Engineer roles at Adobe in Vancouver. ||| Security Engineer ||| Adobe ||| Vancouver ||| Design a rate limiter supporting sliding window semantics.
893,What should I study for a Software Engineer position at Uber (location: Bangalore)?,Software Engineer,Uber,Bangalore,System Design,Design a globally distributed URL shortener.,What should I study for a Software Engineer position at Uber (location: Bangalore)? ||| Software Engineer ||| Uber ||| Bangalore ||| Design a globally distributed URL shortener.,What should I study for a Software Engineer position at Uber (location: Bangalore)? ||| Software Engineer ||| Uber ||| Bangalore ||| Design a globally distributed URL shortener.
1118,What should I study for a Product Manager position at Snap (location: Austin)?,Product Manager,Snap,Austin,System Design,Design a recommendation system for short video feed.,What should I study for a Product Manager position at Snap (location: Austin)? ||| Product Manager ||| Snap ||| Austin ||| Design a recommendation system for short video feed.,What should I study for a Product Manager position at Snap (location: Austin)? ||| Product Manager ||| Snap ||| Austin ||| Design a recommendation system for short video feed.
