id,user_query,job_role,company,location,interview_round,mock_question,text,__text__
1032,I have an interview for Backend Engineer at Apple in Singapore — what mock questions should I expect?,Backend Engineer,Apple,Singapore,System Design,Design a real-time ride-hailing dispatch system.,I have an interview for Backend Engineer at Apple in Singapore — what mock questions should I expect? ||| Backend Engineer ||| Apple ||| Singapore ||| Design a real-time ride-hailing dispatch system.,I have an interview for Backend Engineer at Apple in Singapore — what mock questions should I expect? ||| Backend Engineer ||| Apple ||| Singapore ||| Design a real-time ride-hailing dispatch system.
1814,I'm preparing for a SRE interview at Airbnb in Bangalore. Can you give mock questions?,SRE,Airbnb,Bangalore,ML Case Study,Design an offline/online training pipeline for user embeddings.,I'm preparing for a SRE interview at Airbnb in Bangalore. Can you give mock questions? ||| SRE ||| Airbnb ||| Bangalore ||| Design an offline/online training pipeline for user embeddings.,I'm preparing for a SRE interview at Airbnb in Bangalore. Can you give mock questions? ||| SRE ||| Airbnb ||| Bangalore ||| Design an offline/online training pipeline for user embeddings.
1492,I have an interview for QA Engineer at Stripe in Toronto — what mock questions should I expect?,QA Engineer,Stripe,Toronto,Behavioral/HR,Describe a conflict with a teammate and how you resolved it.,I have an interview for QA Engineer at Stripe in Toronto — what mock questions should I expect? ||| QA Engineer ||| Stripe ||| Toronto ||| Describe a conflict with a teammate and how you resolved it.,I have an interview for QA Engineer at Stripe in Toronto — what mock questions should I expect? ||| QA Engineer ||| Stripe ||| Toronto ||| Describe a conflict with a teammate and how you resolved it.
1194,What should I study for a QA Engineer position at Google (location: Dublin)?,QA Engineer,Google,Dublin,System Design,Design a scalable feature store for ML training/inference.,What should I study for a QA Engineer position at Google (location: Dublin)? ||| QA Engineer ||| Google ||| Dublin ||| Design a scalable feature store for ML training/inference.,What should I study for a QA Engineer position at Google (location: Dublin)? ||| QA Engineer ||| Google ||| Dublin ||| Design a scalable feature store for ML training/inference.
364,Give me common interview problems for Software Engineer roles at Amazon in Paris.,Software Engineer,Amazon,Paris,OA,Count islands in a binary matrix using DFS/BFS.,Give me common interview problems for Software Engineer roles at Amazon in Paris. ||| Software Engineer ||| Amazon ||| Paris ||| Count islands in a binary matrix using DFS/BFS.,Give me common interview problems for Software Engineer roles at Amazon in Paris. ||| Software Engineer ||| Amazon ||| Paris ||| Count islands in a binary matrix using DFS/BFS.
699,I have an interview for Data Engineer at Google in Bangalore — what mock questions should I expect?,Data Engineer,Google,Bangalore,Technical,Serialize and deserialize a binary tree.,I have an interview for Data Engineer at Google in Bangalore — what mock questions should I expect? ||| Data Engineer ||| Google ||| Bangalore ||| Serialize and deserialize a binary tree.,I have an interview for Data Engineer at Google in Bangalore — what mock questions should I expect? ||| Data Engineer ||| Google ||| Bangalore ||| Serialize and deserialize a binary tree.
1115,Give me common interview problems for Data Engineer roles at Snap in Sydney.,Data Engineer,Snap,Sydney,System Design,Design a recommendation system for short video feed.,Give me common interview problems for Data Engineer roles at Snap in Sydney. ||| Data Engineer ||| Snap ||| Sydney ||| Design a recommendation system for short video feed.,Give me common interview problems for Data Engineer roles at Snap in Sydney. ||| Data Engineer ||| Snap ||| Sydney ||| Design a recommendation system for short video feed.
1942,Help me practice for Product Manager interviews at Stripe located in Munich.,Product Manager,Stripe,Munich,ML Case Study,Design an offline/online training pipeline for user embeddings.,Help me practice for Product Manager interviews at Stripe located in Munich. ||| Product Manager ||| Stripe ||| Munich ||| Design an offline/online training pipeline for user embeddings.,Help me practice for Product Manager interviews at Stripe located in Munich. ||| Product Manager ||| Stripe ||| Munich ||| Design an offline/online training pipeline for user embeddings.
925,Give me common interview problems for SRE roles at Microsoft in Berlin.,SRE,Microsoft,Berlin,System Design,Design a scalable feature store for ML training/inference.,Give me common interview problems for SRE roles at Microsoft in Berlin. ||| SRE ||| Microsoft ||| Berlin ||| Design a scalable feature store for ML training/inference.,Give me common interview problems for SRE roles at Microsoft in Berlin. ||| SRE ||| Microsoft ||| Berlin ||| Design a scalable feature store for ML training/inference.
1861,I have an interview for Security Engineer at Salesforce in Melbourne — what mock questions should I expect?,Security Engineer,Salesforce,Melbourne,ML Case Study,Propose an evaluation plan for a recommendation model with cold-start users.,I have an interview for Security Engineer at Salesforce in Melbourne — what mock questions should I expect? ||| Security Engineer ||| Salesforce ||| Melbourne ||| Propose an evaluation plan for a recommendation model with cold-start users.,I have an interview for Security Engineer at Salesforce in Melbourne — what mock questions should I expect? ||| Security Engineer ||| Salesforce ||| Melbourne ||| Propose an evaluation plan for a recommendation model with cold-start users.
1110,Help me practice for Data Scientist interviews at Pinterest located in Austin.,Data Scientist,Pinterest,Austin,System Design,Design logging ingestion at 10M events/sec.,Help me practice for Data Scientist interviews at Pinterest located in Austin. ||| Data Scientist ||| Pinterest ||| Austin ||| Design logging ingestion at 10M events/sec.,Help me practice for Data Scientist interviews at Pinterest located in Austin. ||| Data Scientist ||| Pinterest ||| Austin ||| Design logging ingestion at 10M events/sec.
455,I'm preparing for a ML Engineer interview at Uber in Paris. Can you give mock questions?,ML Engineer,Uber,Paris,Technical,"Given intervals, merge overlapping ones.","I'm preparing for a ML Engineer interview at Uber in Paris. Can you give mock questions? ||| ML Engineer ||| Uber ||| Paris ||| Given intervals, merge overlapping ones.","I'm preparing for a ML Engineer interview at Uber in Paris. Can you give mock questions? ||| ML Engineer ||| Uber ||| Paris ||| Given intervals, merge overlapping ones."
1475,I have an interview for Security Engineer at Netflix in Melbourne — what mock questions should I expect?,Security Engineer,Netflix,Melbourne,Behavioral/HR,Describe a conflict with a teammate and how you resolved it.,I have an interview for Security Engineer at Netflix in Melbourne — what mock questions should I expect? ||| Security Engineer ||| Netflix ||| Melbourne ||| Describe a conflict with a teammate and how you resolved it.,I have an interview for Security Engineer at Netflix in Melbourne — what mock questions should I expect? ||| Security Engineer ||| Netflix ||| Melbourne ||| Describe a conflict with a teammate and how you resolved it.
308,What should I study for a Data Scientist position at Salesforce (location: Munich)?,Data Scientist,Salesforce,Munich,OA,Count islands in a binary matrix using DFS/BFS.,What should I study for a Data Scientist position at Salesforce (location: Munich)? ||| Data Scientist ||| Salesforce ||| Munich ||| Count islands in a binary matrix using DFS/BFS.,What should I study for a Data Scientist position at Salesforce (location: Munich)? ||| Data Scientist ||| Salesforce ||| Munich ||| Count islands in a binary matrix using DFS/BFS.
179,I have an interview for Backend Engineer at Pinterest in Sydney — what mock questions should I expect?,Backend Engineer,Pinterest,Sydney,OA,Implement two-sum with optimal complexity.,I have an interview for Backend Engineer at Pinterest in Sydney — what mock questions should I expect? ||| Backend Engineer ||| Pinterest ||| Sydney ||| Implement two-sum with optimal complexity.,I have an interview for Backend Engineer at Pinterest in Sydney — what mock questions should I expect? ||| Backend Engineer ||| Pinterest ||| Sydney ||| Implement two-sum with optimal complexity.
278,Give me common interview problems for Software Engineer roles at Snap in London.,Software Engineer,Snap,London,OA,Count islands in a binary matrix using DFS/BFS.,Give me common interview problems for Software Engineer roles at Snap in London. ||| Software Engineer ||| Snap ||| London ||| Count islands in a binary matrix using DFS/BFS.,Give me common interview problems for Software Engineer roles at Snap in London. ||| Software Engineer ||| Snap ||| London ||| Count islands in a binary matrix using DFS/BFS.
414,Help me practice for Software Engineer interviews at Pinterest located in LA.,Software Engineer,Pinterest,LA,Technical,Design a rate limiter supporting sliding window semantics.,Help me practice for Software Engineer interviews at Pinterest located in LA. ||| Software Engineer ||| Pinterest ||| LA ||| Design a rate limiter supporting sliding window semantics.,Help me practice for Software Engineer interviews at Pinterest located in LA. ||| Software Engineer ||| Pinterest ||| LA ||| Design a rate limiter supporting sliding window semantics.
1670,What should I study for a ML Engineer position at Netflix (location: Munich)?,ML Engineer,Netflix,Munich,ML Case Study,How to measure fairness and bias in a loan prediction model?,What should I study for a ML Engineer position at Netflix (location: Munich)? ||| ML Engineer ||| Netflix ||| Munich ||| How to measure fairness and bias in a loan prediction model?,What should I study for a ML Engineer position at Netflix (location: Munich)? ||| ML Engineer ||| Netflix ||| Munich ||| How to measure fairness and bias in a loan prediction model?
66,What should I study for a Data Engineer position at LinkedIn (location: Singapore)?,Data Engineer,LinkedIn,Singapore,OA,Compute running median from a data stream.,What should I study for a Data Engineer position at LinkedIn (location: Singapore)? ||| Data Engineer ||| LinkedIn ||| Singapore ||| Compute running median from a data stream.,What should I study for a Data Engineer position at LinkedIn (location: Singapore)? ||| Data Engineer ||| LinkedIn ||| Singapore ||| Compute running median from a data stream.
964,I'm preparing for a Security Engineer interview at Intuit in Sydney. Can you give mock questions?,Security Engineer,Intuit,Sydney,System Design,Design a messaging queue with at-least-once delivery.,I'm preparing for a Security Engineer interview at Intuit in Sydney. Can you give mock questions? ||| Security Engineer ||| Intuit ||| Sydney ||| Design a messaging queue with at-least-once delivery.,I'm preparing for a Security Engineer interview at Intuit in Sydney. Can you give mock questions? ||| Security Engineer ||| Intuit ||| Sydney ||| Design a messaging queue with at-least-once delivery.
1870,What should I study for a Backend Engineer position at Airbnb (location: Paris)?,Backend Engineer,Airbnb,Paris,ML Case Study,Design an offline/online training pipeline for user embeddings.,What should I study for a Backend Engineer position at Airbnb (location: Paris)? ||| Backend Engineer ||| Airbnb ||| Paris ||| Design an offline/online training pipeline for user embeddings.,What should I study for a Backend Engineer position at Airbnb (location: Paris)? ||| Backend Engineer ||| Airbnb ||| Paris ||| Design an offline/online training pipeline for user embeddings.
72,I'm preparing for a QA Engineer interview at NVIDIA in Bangalore. Can you give mock questions?,QA Engineer,NVIDIA,Bangalore,OA,Implement two-sum with optimal complexity.,I'm preparing for a QA Engineer interview at NVIDIA in Bangalore. Can you give mock questions? ||| QA Engineer ||| NVIDIA ||| Bangalore ||| Implement two-sum with optimal complexity.,I'm preparing for a QA Engineer interview at NVIDIA in Bangalore. Can you give mock questions? ||| QA Engineer ||| NVIDIA ||| Bangalore ||| Implement two-sum with optimal complexity.
410,I have an interview for ML Engineer at Twitter in Remote — what mock questions should I expect?,ML Engineer,Twitter,Remote,Technical,"Given intervals, merge overlapping ones.","I have an interview for ML Engineer at Twitter in Remote — what mock questions should I expect? ||| ML Engineer ||| Twitter ||| Remote ||| Given intervals, merge overlapping ones.","I have an interview for ML Engineer at Twitter in Remote — what mock questions should I expect? ||| ML Engineer ||| Twitter ||| Remote ||| Given intervals, merge overlapping ones."
1217,I'm preparing for a QA Engineer interview at Adobe in Bangalore. Can you give mock questions?,QA Engineer,Adobe,Bangalore,Behavioral/HR,Tell me about a project where you had to learn something quickly.,I'm preparing for a QA Engineer interview at Adobe in Bangalore. Can you give mock questions? ||| QA Engineer ||| Adobe ||| Bangalore ||| Tell me about a project where you had to learn something quickly.,I'm preparing for a QA Engineer interview at Adobe in Bangalore. Can you give mock questions? ||| QA Engineer ||| Adobe ||| Bangalore ||| Tell me about a project where you had to learn something quickly.
1499,I have an interview for Product Manager at Meta in Vancouver — what mock questions should I expect?,Product Manager,Meta,Vancouver,Behavioral/HR,Tell me about a project where you had to learn something quickly.,I have an interview for Product Manager at Meta in Vancouver — what mock questions should I expect? ||| Product Manager ||| Meta ||| Vancouver ||| Tell me about a project where you had to learn something quickly.,I have an interview for Product Manager at Meta in Vancouver — what mock questions should I expect? ||| Product Manager ||| Meta ||| Vancouver ||| Tell me about a project where you had to learn something quickly.
2000,Help me practice for SRE interviews at Shopify located in Dublin.,SRE,Shopify,Dublin,ML Case Study,How to measure fairness and bias in a loan prediction model?,Help me practice for SRE interviews at Shopify located in Dublin. ||| SRE ||| Shopify ||| Dublin ||| How to measure fairness and bias in a loan prediction model?,Help me practice for SRE interviews at Shopify located in Dublin. ||| SRE ||| Shopify ||| Dublin ||| How to measure fairness and bias in a loan prediction model?
468,I'm preparing for a Data Scientist interview at Shopify in Hyderabad. Can you give mock questions?,Data Scientist,Shopify,Hyderabad,Technical,Implement union-find with path compression.,I'm preparing for a Data Scientist interview at Shopify in Hyderabad. Can you give mock questions? ||| Data Scientist ||| Shopify ||| Hyderabad ||| Implement union-find with path compression.,I'm preparing for a Data Scientist interview at Shopify in Hyderabad. Can you give mock questions? ||| Data Scientist ||| Shopify ||| Hyderabad ||| Implement union-find with path compression.
950,Give me common interview problems for ML Engineer roles at Google in Singapore.,ML Engineer,Google,Singapore,System Design,Design a real-time ride-hailing dispatch system.,Give me common interview problems for ML Engineer roles at Google in Singapore. ||| ML Engineer ||| Google ||| Singapore ||| Design a real-time ride-hailing dispatch system.,Give me common interview problems for ML Engineer roles at Google in Singapore. ||| ML Engineer ||| Google ||| Singapore ||| Design a real-time ride-hailing dispatch system.
1285,Give me common interview problems for Data Scientist roles at Airbnb in London.,Data Scientist,Airbnb,London,Behavioral/HR,Tell me about a project where you had to learn something quickly.,Give me common interview problems for Data Scientist roles at Airbnb in London. ||| Data Scientist ||| Airbnb ||| London ||| Tell me about a project where you had to learn something quickly.,Give me common interview problems for Data Scientist roles at Airbnb in London. ||| Data Scientist ||| Airbnb ||| London ||| Tell me about a project where you had to learn something quickly.
1003,I have an interview for Product Manager at Shopify in Munich — what mock questions should I expect?,Product Manager,Shopify,Munich,System Design,Design a monitoring/alerting system for microservices.,I have an interview for Product Manager at Shopify in Munich — what mock questions should I expect? ||| Product Manager ||| Shopify ||| Munich ||| Design a monitoring/alerting system for microservices.,I have an interview for Product Manager at Shopify in Munich — what mock questions should I expect? ||| Product Manager ||| Shopify ||| Munich ||| Design a monitoring/alerting system for microservices.
1688,Help me practice for Data Scientist interviews at Twitter located in Seattle.,Data Scientist,Twitter,Seattle,ML Case Study,Propose an evaluation plan for a recommendation model with cold-start users.,Help me practice for Data Scientist interviews at Twitter located in Seattle. ||| Data Scientist ||| Twitter ||| Seattle ||| Propose an evaluation plan for a recommendation model with cold-start users.,Help me practice for Data Scientist interviews at Twitter located in Seattle. ||| Data Scientist ||| Twitter ||| Seattle ||| Propose an evaluation plan for a recommendation model with cold-start users.
1215,Help me practice for ML Engineer interviews at Twitter located in NYC.,ML Engineer,Twitter,NYC,Behavioral/HR,Describe a time you failed and what you learned.,Help me practice for ML Engineer interviews at Twitter located in NYC. ||| ML Engineer ||| Twitter ||| NYC ||| Describe a time you failed and what you learned.,Help me practice for ML Engineer interviews at Twitter located in NYC. ||| ML Engineer ||| Twitter ||| NYC ||| Describe a time you failed and what you learned.
35,I'm preparing for a Data Engineer interview at Snap in Berlin. Can you give mock questions?,Data Engineer,Snap,Berlin,OA,"Given a string, return length of longest substring without repeating characters.","I'm preparing for a Data Engineer interview at Snap in Berlin. Can you give mock questions? ||| Data Engineer ||| Snap ||| Berlin ||| Given a string, return length of longest substring without repeating characters.","I'm preparing for a Data Engineer interview at Snap in Berlin. Can you give mock questions? ||| Data Engineer ||| Snap ||| Berlin ||| Given a string, return length of longest substring without repeating characters."
968,Give me common interview problems for QA Engineer roles at Meta in Berlin.,QA Engineer,Meta,Berlin,System Design,Design a scalable feature store for ML training/inference.,Give me common interview problems for QA Engineer roles at Meta in Berlin. ||| QA Engineer ||| Meta ||| Berlin ||| Design a scalable feature store for ML training/inference.,Give me common interview problems for QA Engineer roles at Meta in Berlin. ||| QA Engineer ||| Meta ||| Berlin ||| Design a scalable feature store for ML training/inference.
582,I'm preparing for a Security Engineer interview at NVIDIA in Hyderabad. Can you give mock questions?,Security Engineer,NVIDIA,Hyderabad,Technical,Implement union-find with path compression.,I'm preparing for a Security Engineer interview at NVIDIA in Hyderabad. Can you give mock questions? ||| Security Engineer ||| NVIDIA ||| Hyderabad ||| Implement union-find with path compression.,I'm preparing for a Security Engineer interview at NVIDIA in Hyderabad. Can you give mock questions? ||| Security Engineer ||| NVIDIA ||| Hyderabad ||| Implement union-find with path compression.
1624,I have an interview for Backend Engineer at LinkedIn in Chicago — what mock questions should I expect?,Backend Engineer,LinkedIn,Chicago,ML Case Study,Design an offline/online training pipeline for user embeddings.,I have an interview for Backend Engineer at LinkedIn in Chicago — what mock questions should I expect? ||| Backend Engineer ||| LinkedIn ||| Chicago ||| Design an offline/online training pipeline for user embeddings.,I have an interview for Backend Engineer at LinkedIn in Chicago — what mock questions should I expect? ||| Backend Engineer ||| LinkedIn ||| Chicago ||| Design an offline/online training pipeline for user embeddings.
643,Help me practice for QA Engineer interviews at Stripe located in Melbourne.,QA Engineer,Stripe,Melbourne,Technical,Implement Dijkstra's algorithm for sparse graphs.,Help me practice for QA Engineer interviews at Stripe located in Melbourne. ||| QA Engineer ||| Stripe ||| Melbourne ||| Implement Dijkstra's algorithm for sparse graphs.,Help me practice for QA Engineer interviews at Stripe located in Melbourne. ||| QA Engineer ||| Stripe ||| Melbourne ||| Implement Dijkstra's algorithm for sparse graphs.
519,What should I study for a Product Manager position at LinkedIn (location: Austin)?,Product Manager,LinkedIn,Austin,Technical,Implement an LRU cache with O(1) operations.,What should I study for a Product Manager position at LinkedIn (location: Austin)? ||| Product Manager ||| LinkedIn ||| Austin ||| Implement an LRU cache with O(1) operations.,What should I study for a Product Manager position at LinkedIn (location: Austin)? ||| Product Manager ||| LinkedIn ||| Austin ||| Implement an LRU cache with O(1) operations.
1625,What should I study for a QA Engineer position at Meta (location: Boston)?,QA Engineer,Meta,Boston,ML Case Study,Design an offline/online training pipeline for user embeddings.,What should I study for a QA Engineer position at Meta (location: Boston)? ||| QA Engineer ||| Meta ||| Boston ||| Design an offline/online training pipeline for user embeddings.,What should I study for a QA Engineer position at Meta (location: Boston)? ||| QA Engineer ||| Meta ||| Boston ||| Design an offline/online training pipeline for user embeddings.
727,What should I study for a SRE position at Snap (location: NYC)?,SRE,Snap,NYC,Technical,Serialize and deserialize a binary tree.,What should I study for a SRE position at Snap (location: NYC)? ||| SRE ||| Snap ||| NYC ||| Serialize and deserialize a binary tree.,What should I study for a SRE position at Snap (location: NYC)? ||| SRE ||| Snap ||| NYC ||| Serialize and deserialize a binary tree.
1912,Help me practice for SRE interviews at Amazon located in Vancouver.,SRE,Amazon,Vancouver,ML Case Study,Design an offline/online training pipeline for user embeddings.,Help me practice for SRE interviews at Amazon located in Vancouver. ||| SRE ||| Amazon ||| Vancouver ||| Design an offline/online training pipeline for user embeddings.,Help me practice for SRE interviews at Amazon located in Vancouver. ||| SRE ||| Amazon ||| Vancouver ||| Design an offline/online training pipeline for user embeddings.
599,Help me practice for ML Engineer interviews at Stripe located in Vancouver.,ML Engineer,Stripe,Vancouver,Technical,"Given intervals, merge overlapping ones.","Help me practice for ML Engineer interviews at Stripe located in Vancouver. ||| ML Engineer ||| Stripe ||| Vancouver ||| Given intervals, merge overlapping ones.","Help me practice for ML Engineer interviews at Stripe located in Vancouver. ||| ML Engineer ||| Stripe ||| Vancouver ||| Given intervals, merge overlapping ones."
1583,What should I study for a QA Engineer position at Google (location: Seattle)?,QA Engineer,Google,Seattle,Behavioral/HR,Describe a time you failed and what you learned.,What should I study for a QA Engineer position at Google (location: Seattle)? ||| QA Engineer ||| Google ||| Seattle ||| Describe a time you failed and what you learned.,What should I study for a QA Engineer position at Google (location: Seattle)? ||| QA Engineer ||| Google ||| Seattle ||| Describe a time you failed and what you learned.
1308,I have an interview for Frontend Engineer at Adobe in Sydney — what mock questions should I expect?,Frontend Engineer,Adobe,Sydney,Behavioral/HR,Tell me about a project where you had to learn something quickly.,I have an interview for Frontend Engineer at Adobe in Sydney — what mock questions should I expect? ||| Frontend Engineer ||| Adobe ||| Sydney ||| Tell me about a project where you had to learn something quickly.,I have an interview for Frontend Engineer at Adobe in Sydney — what mock questions should I expect? ||| Frontend Engineer ||| Adobe ||| Sydney ||| Tell me about a project where you had to learn something quickly.
881,Help me practice for Backend Engineer interviews at Google located in Hyderabad.,Backend Engineer,Google,Hyderabad,System Design,Design a real-time ride-hailing dispatch system.,Help me practice for Backend Engineer interviews at Google located in Hyderabad. ||| Backend Engineer ||| Google ||| Hyderabad ||| Design a real-time ride-hailing dispatch system.,Help me practice for Backend Engineer interviews at Google located in Hyderabad. ||| Backend Engineer ||| Google ||| Hyderabad ||| Design a real-time ride-hailing dispatch system.
1051,What should I study for a Frontend Engineer position at Snap (location: Toronto)?,Frontend Engineer,Snap,Toronto,System Design,Design a globally distributed URL shortener.,What should I study for a Frontend Engineer position at Snap (location: Toronto)? ||| Frontend Engineer ||| Snap ||| Toronto ||| Design a globally distributed URL shortener.,What should I study for a Frontend Engineer position at Snap (location: Toronto)? ||| Frontend Engineer ||| Snap ||| Toronto ||| Design a globally distributed URL shortener.
