id,user_query,job_role,company,location,interview_round,mock_question,text,__text__
1148,What should I study for a Software Engineer position at Apple (location: Paris)?,Software Engineer,Apple,Paris,System Design,Design a recommendation system for short video feed.,What should I study for a Software Engineer position at Apple (location: Paris)? ||| Software Engineer ||| Apple ||| Paris ||| Design a recommendation system for short video feed.,What should I study for a Software Engineer position at Apple (location: Paris)? ||| Software Engineer ||| Apple ||| Paris ||| Design a recommendation system for short video feed.
852,What should I study for a Security Engineer position at Uber (location: Dublin)?,Security Engineer,Uber,Dublin,System Design,Design a recommendation system for short video feed.,What should I study for a Security Engineer position at Uber (location: Dublin)? ||| Security Engineer ||| Uber ||| Dublin ||| Design a recommendation system for short video feed.,What should I study for a Security Engineer position at Uber (location: Dublin)? ||| Security Engineer ||| Uber ||| Dublin ||| Design a recommendation system for short video feed.
1033,Help me practice for Data Engineer interviews at Intuit located in Melbourne.,Data Engineer,Intuit,Melbourne,System Design,Design a globally distributed URL shortener.,Help me practice for Data Engineer interviews at Intuit located in Melbourne. ||| Data Engineer ||| Intuit ||| Melbourne ||| Design a globally distributed URL shortener.,Help me practice for Data Engineer interviews at Intuit located in Melbourne. ||| Data Engineer ||| Intuit ||| Melbourne ||| Design a globally distributed URL shortener.
1525,I'm preparing for a Product Manager interview at Stripe in Bay Area. Can you give mock questions?,Product Manager,Stripe,Bay Area,Behavioral/HR,Describe a time you failed and what you learned.,I'm preparing for a Product Manager interview at Stripe in Bay Area. Can you give mock questions? ||| Product Manager ||| Stripe ||| Bay Area ||| Describe a time you failed and what you learned.,I'm preparing for a Product Manager interview at Stripe in Bay Area. Can you give mock questions? ||| Product Manager ||| Stripe ||| Bay Area ||| Describe a time you failed and what you learned.
1053,Give me common interview problems for Data Scientist roles at Salesforce in Chicago.,Data Scientist,Salesforce,Chicago,System Design,Design logging ingestion at 10M events/sec.,Give me common interview problems for Data Scientist roles at Salesforce in Chicago. ||| Data Scientist ||| Salesforce ||| Chicago ||| Design logging ingestion at 10M events/sec.,Give me common interview problems for Data Scientist roles at Salesforce in Chicago. ||| Data Scientist ||| Salesforce ||| Chicago ||| Design logging ingestion at 10M events/sec.
4,Help me practice for Backend Engineer interviews at Dropbox located in Hyderabad.,Backend Engineer,Dropbox,Hyderabad,OA,"Given a string, return length of longest substring without repeating characters.","Help me practice for Backend Engineer interviews at Dropbox located in Hyderabad. ||| Backend Engineer ||| Dropbox ||| Hyderabad ||| Given a string, return length of longest substring without repeating characters.","Help me practice for Backend Engineer interviews at Dropbox located in Hyderabad. ||| Backend Engineer ||| Dropbox ||| Hyderabad ||| Given a string, return length of longest substring without repeating characters."
1337,I'm preparing for a Data Engineer interview at Pinterest in Singapore. Can you give mock questions?,Data Engineer,Pinterest,Singapore,Behavioral/HR,Describe a conflict with a teammate and how you resolved it.,I'm preparing for a Data Engineer interview at Pinterest in Singapore. Can you give mock questions? ||| Data Engineer ||| Pinterest ||| Singapore ||| Describe a conflict with a teammate and how you resolved it.,I'm preparing for a Data Engineer interview at Pinterest in Singapore. Can you give mock questions? ||| Data Engineer ||| Pinterest ||| Singapore ||| Describe a conflict with a teammate and how you resolved it.
503,What should I study for a SRE position at LinkedIn (location: Bay Area)?,SRE,LinkedIn,Bay Area,Technical,Find the longest consecutive sequence length.,What should I study for a SRE position at LinkedIn (location: Bay Area)? ||| SRE ||| LinkedIn ||| Bay Area ||| Find the longest consecutive sequence length.,What should I study for a SRE position at LinkedIn (location: Bay Area)? ||| SRE ||| LinkedIn ||| Bay Area ||| Find the longest consecutive sequence length.
923,I have an interview for Software Engineer at Pinterest in LA — what mock questions should I expect?,Software Engineer,Pinterest,LA,System Design,Design a messaging queue with at-least-once delivery.,I have an interview for Software Engineer at Pinterest in LA — what mock questions should I expect? ||| Software Engineer ||| Pinterest ||| LA ||| Design a messaging queue with at-least-once delivery.,I have an interview for Software Engineer at Pinterest in LA — what mock questions should I expect? ||| Software Engineer ||| Pinterest ||| LA ||| Design a messaging queue with at-least-once delivery.
322,I have an interview for Software Engineer at Salesforce in Munich — what mock questions should I expect?,Software Engineer,Salesforce,Munich,OA,"Given a string, return length of longest substring without repeating characters.","I have an interview for Software Engineer at Salesforce in Munich — what mock questions should I expect? ||| Software Engineer ||| Salesforce ||| Munich ||| Given a string, return length of longest substring without repeating characters.","I have an interview for Software Engineer at Salesforce in Munich — what mock questions should I expect? ||| Software Engineer ||| Salesforce ||| Munich ||| Given a string, return length of longest substring without repeating characters."
212,What should I study for a Data Engineer position at NVIDIA (location: Toronto)?,Data Engineer,NVIDIA,Toronto,OA,"Given a string, return length of longest substring without repeating characters.","What should I study for a Data Engineer position at NVIDIA (location: Toronto)? ||| Data Engineer ||| NVIDIA ||| Toronto ||| Given a string, return length of longest substring without repeating characters.","What should I study for a Data Engineer position at NVIDIA (location: Toronto)? ||| Data Engineer ||| NVIDIA ||| Toronto ||| Given a string, return length of longest substring without repeating characters."
545,I'm preparing for a SRE interview at NVIDIA in London. Can you give mock questions?,SRE,NVIDIA,London,Technical,Implement union-find with path compression.,I'm preparing for a SRE interview at NVIDIA in London. Can you give mock questions? ||| SRE ||| NVIDIA ||| London ||| Implement union-find with path compression.,I'm preparing for a SRE interview at NVIDIA in London. Can you give mock questions? ||| SRE ||| NVIDIA ||| London ||| Implement union-find with path compression.
1206,I'm preparing for a SRE interview at Meta in LA. Can you give mock questions?,SRE,Meta,LA,Behavioral/HR,Tell me about a time you handled an ambiguous requirement.,I'm preparing for a SRE interview at Meta in LA. Can you give mock questions? ||| SRE ||| Meta ||| LA ||| Tell me about a time you handled an ambiguous requirement.,I'm preparing for a SRE interview at Meta in LA. Can you give mock questions? ||| SRE ||| Meta ||| LA ||| Tell me about a time you handled an ambiguous requirement.
780,I have an interview for Data Scientist at Netflix in Toronto — what mock questions should I expect?,Data Scientist,Netflix,Toronto,Technical,Implement Dijkstra's algorithm for sparse graphs.,I have an interview for Data Scientist at Netflix in Toronto — what mock questions should I expect? ||| Data Scientist ||| Netflix ||| Toronto ||| Implement Dijkstra's algorithm for sparse graphs.,I have an interview for Data Scientist at Netflix in Toronto — what mock questions should I expect? ||| Data Scientist ||| Netflix ||| Toronto ||| Implement Dijkstra's algorithm for sparse graphs.
1020,I'm preparing for a Security Engineer interview at Twitter in Berlin. Can you give mock questions?,Security Engineer,Twitter,Berlin,System Design,Design a real-time ride-hailing dispatch system.,I'm preparing for a Security Engineer interview at Twitter in Berlin. Can you give mock questions? ||| Security Engineer ||| Twitter ||| Berlin ||| Design a real-time ride-hailing dispatch system.,I'm preparing for a Security Engineer interview at Twitter in Berlin. Can you give mock questions? ||| Security Engineer ||| Twitter ||| Berlin ||| Design a real-time ride-hailing dispatch system.
393,Help me practice for Frontend Engineer interviews at Dropbox located in Paris.,Frontend Engineer,Dropbox,Paris,OA,Implement two-sum with optimal complexity.,Help me practice for Frontend Engineer interviews at Dropbox located in Paris. ||| Frontend Engineer ||| Dropbox ||| Paris ||| Implement two-sum with optimal complexity.,Help me practice for Frontend Engineer interviews at Dropbox located in Paris. ||| Frontend Engineer ||| Dropbox ||| Paris ||| Implement two-sum with optimal complexity.
1277,Give me common interview problems for Frontend Engineer roles at Reddit in Paris.,Frontend Engineer,Reddit,Paris,Behavioral/HR,Describe a time you failed and what you learned.,Give me common interview problems for Frontend Engineer roles at Reddit in Paris. ||| Frontend Engineer ||| Reddit ||| Paris ||| Describe a time you failed and what you learned.,Give me common interview problems for Frontend Engineer roles at Reddit in Paris. ||| Frontend Engineer ||| Reddit ||| Paris ||| Describe a time you failed and what you learned.
846,Give me common interview problems for Frontend Engineer roles at Pinterest in Boston.,Frontend Engineer,Pinterest,Boston,System Design,Design a scalable feature store for ML training/inference.,Give me common interview problems for Frontend Engineer roles at Pinterest in Boston. ||| Frontend Engineer ||| Pinterest ||| Boston ||| Design a scalable feature store for ML training/inference.,Give me common interview problems for Frontend Engineer roles at Pinterest in Boston. ||| Frontend Engineer ||| Pinterest ||| Boston ||| Design a scalable feature store for ML training/inference.
524,I have an interview for Security Engineer at Airbnb in Bay Area — what mock questions should I expect?,Security Engineer,Airbnb,Bay Area,Technical,Implement Dijkstra's algorithm for sparse graphs.,I have an interview for Security Engineer at Airbnb in Bay Area — what mock questions should I expect? ||| Security Engineer ||| Airbnb ||| Bay Area ||| Implement Dijkstra's algorithm for sparse graphs.,I have an interview for Security Engineer at Airbnb in Bay Area — what mock questions should I expect? ||| Security Engineer ||| Airbnb ||| Bay Area ||| Implement Dijkstra's algorithm for sparse graphs.
1197,What should I study for a ML Engineer position at Twitter (location: London)?,ML Engineer,Twitter,London,System Design,Design a globally distributed URL shortener.,What should I study for a ML Engineer position at Twitter (location: London)? ||| ML Engineer ||| Twitter ||| London ||| Design a globally distributed URL shortener.,What should I study for a ML Engineer position at Twitter (location: London)? ||| ML Engineer ||| Twitter ||| London ||| Design a globally distributed URL shortener.
1042,What should I study for a ML Engineer position at Reddit (location: Melbourne)?,ML Engineer,Reddit,Melbourne,System Design,Design a globally distributed URL shortener.,What should I study for a ML Engineer position at Reddit (location: Melbourne)? ||| ML Engineer ||| Reddit ||| Melbourne ||| Design a globally distributed URL shortener.,What should I study for a ML Engineer position at Reddit (location: Melbourne)? ||| ML Engineer ||| Reddit ||| Melbourne ||| Design a globally distributed URL shortener.
415,What should I study for a ML Engineer position at Meta (location: Vancouver)?,ML Engineer,Meta,Vancouver,Technical,Implement Dijkstra's algorithm for sparse graphs.,What should I study for a ML Engineer position at Meta (location: Vancouver)? ||| ML Engineer ||| Meta ||| Vancouver ||| Implement Dijkstra's algorithm for sparse graphs.,What should I study for a ML Engineer position at Meta (location: Vancouver)? ||| ML Engineer ||| Meta ||| Vancouver ||| Implement Dijkstra's algorithm for sparse graphs.
293,What should I study for a Backend Engineer position at Meta (location: Munich)?,Backend Engineer,Meta,Munich,OA,"Given a string, return length of longest substring without repeating characters.","What should I study for a Backend Engineer position at Meta (location: Munich)? ||| Backend Engineer ||| Meta ||| Munich ||| Given a string, return length of longest substring without repeating characters.","What should I study for a Backend Engineer position at Meta (location: Munich)? ||| Backend Engineer ||| Meta ||| Munich ||| Given a string, return length of longest substring without repeating characters."
1631,Help me practice for Product Manager interviews at Microsoft located in Dublin.,Product Manager,Microsoft,Dublin,ML Case Study,How would you detect data drift and trigger model retraining?,Help me practice for Product Manager interviews at Microsoft located in Dublin. ||| Product Manager ||| Microsoft ||| Dublin ||| How would you detect data drift and trigger model retraining?,Help me practice for Product Manager interviews at Microsoft located in Dublin. ||| Product Manager ||| Microsoft ||| Dublin ||| How would you detect data drift and trigger model retraining?
1683,I'm preparing for a Product Manager interview at Adobe in Austin. Can you give mock questions?,Product Manager,Adobe,Austin,ML Case Study,How would you detect data drift and trigger model retraining?,I'm preparing for a Product Manager interview at Adobe in Austin. Can you give mock questions? ||| Product Manager ||| Adobe ||| Austin ||| How would you detect data drift and trigger model retraining?,I'm preparing for a Product Manager interview at Adobe in Austin. Can you give mock questions? ||| Product Manager ||| Adobe ||| Austin ||| How would you detect data drift and trigger model retraining?
600,Help me practice for Frontend Engineer interviews at LinkedIn located in Seattle.,Frontend Engineer,LinkedIn,Seattle,Technical,Implement Dijkstra's algorithm for sparse graphs.,Help me practice for Frontend Engineer interviews at LinkedIn located in Seattle. ||| Frontend Engineer ||| LinkedIn ||| Seattle ||| Implement Dijkstra's algorithm for sparse graphs.,Help me practice for Frontend Engineer interviews at LinkedIn located in Seattle. ||| Frontend Engineer ||| LinkedIn ||| Seattle ||| Implement Dijkstra's algorithm for sparse graphs.
1928,Help me practice for Frontend Engineer interviews at Reddit located in Bay Area.,Frontend Engineer,Reddit,Bay Area,ML Case Study,How to measure fairness and bias in a loan prediction model?,Help me practice for Frontend Engineer interviews at Reddit located in Bay Area. ||| Frontend Engineer ||| Reddit ||| Bay Area ||| How to measure fairness and bias in a loan prediction model?,Help me practice for Frontend Engineer interviews at Reddit located in Bay Area. ||| Frontend Engineer ||| Reddit ||| Bay Area ||| How to measure fairness and bias in a loan prediction model?
1450,I'm preparing for a Software Engineer interview at Microsoft in London. Can you give mock questions?,Software Engineer,Microsoft,London,Behavioral/HR,Tell me about a time you handled an ambiguous requirement.,I'm preparing for a Software Engineer interview at Microsoft in London. Can you give mock questions? ||| Software Engineer ||| Microsoft ||| London ||| Tell me about a time you handled an ambiguous requirement.,I'm preparing for a Software Engineer interview at Microsoft in London. Can you give mock questions? ||| Software Engineer ||| Microsoft ||| London ||| Tell me about a time you handled an ambiguous requirement.
785,Give me common interview problems for Software Engineer roles at Salesforce in Sydney.,Software Engineer,Salesforce,Sydney,Technical,Implement union-find with path compression.,Give me common interview problems for Software Engineer roles at Salesforce in Sydney. ||| Software Engineer ||| Salesforce ||| Sydney ||| Implement union-find with path compression.,Give me common interview problems for Software Engineer roles at Salesforce in Sydney. ||| Software Engineer ||| Salesforce ||| Sydney ||| Implement union-find with path compression.
1387,I have an interview for Security Engineer at Meta in Munich — what mock questions should I expect?,Security Engineer,Meta,Munich,Behavioral/HR,Tell me about a project where you had to learn something quickly.,I have an interview for Security Engineer at Meta in Munich — what mock questions should I expect? ||| Security Engineer ||| Meta ||| Munich ||| Tell me about a project where you had to learn something quickly.,I have an interview for Security Engineer at Meta in Munich — what mock questions should I expect? ||| Security Engineer ||| Meta ||| Munich ||| Tell me about a project where you had to learn something quickly.
1730,I'm preparing for a ML Engineer interview at Twitter in LA. Can you give mock questions?,ML Engineer,Twitter,LA,ML Case Study,Design an offline/online training pipeline for user embeddings.,I'm preparing for a ML Engineer interview at Twitter in LA. Can you give mock questions? ||| ML Engineer ||| Twitter ||| LA ||| Design an offline/online training pipeline for user embeddings.,I'm preparing for a ML Engineer interview at Twitter in LA. Can you give mock questions? ||| ML Engineer ||| Twitter ||| LA ||| Design an offline/online training pipeline for user embeddings.
1298,I have an interview for Software Engineer at Airbnb in Sydney — what mock questions should I expect?,Software Engineer,Airbnb,Sydney,Behavioral/HR,Tell me about a time you handled an ambiguous requirement.,I have an interview for Software Engineer at Airbnb in Sydney — what mock questions should I expect? ||| Software Engineer ||| Airbnb ||| Sydney ||| Tell me about a time you handled an ambiguous requirement.,I have an interview for Software Engineer at Airbnb in Sydney — what mock questions should I expect? ||| Software Engineer ||| Airbnb ||| Sydney ||| Tell me about a time you handled an ambiguous requirement.
1867,I'm preparing for a Data Engineer interview at Twitter in Vancouver. Can you give mock questions?,Data Engineer,Twitter,Vancouver,ML Case Study,Propose an evaluation plan for a recommendation model with cold-start users.,I'm preparing for a Data Engineer interview at Twitter in Vancouver. Can you give mock questions? ||| Data Engineer ||| Twitter ||| Vancouver ||| Propose an evaluation plan for a recommendation model with cold-start users.,I'm preparing for a Data Engineer interview at Twitter in Vancouver. Can you give mock questions? ||| Data Engineer ||| Twitter ||| Vancouver ||| Propose an evaluation plan for a recommendation model with cold-start users.
1517,I'm preparing for a Software Engineer interview at Twitter in Sydney. Can you give mock questions?,Software Engineer,Twitter,Sydney,Behavioral/HR,Tell me about a project where you had to learn something quickly.,I'm preparing for a Software Engineer interview at Twitter in Sydney. Can you give mock questions? ||| Software Engineer ||| Twitter ||| Sydney ||| Tell me about a project where you had to learn something quickly.,I'm preparing for a Software Engineer interview at Twitter in Sydney. Can you give mock questions? ||| Software Engineer ||| Twitter ||| Sydney ||| Tell me about a project where you had to learn something quickly.
65,Help me practice for Data Scientist interviews at Google located in Sydney.,Data Scientist,Google,Sydney,OA,Compute running median from a data stream.,Help me practice for Data Scientist interviews at Google located in Sydney. ||| Data Scientist ||| Google ||| Sydney ||| Compute running median from a data stream.,Help me practice for Data Scientist interviews at Google located in Sydney. ||| Data Scientist ||| Google ||| Sydney ||| Compute running median from a data stream.
862,Help me practice for Security Engineer interviews at Twitter located in Berlin.,Security Engineer,Twitter,Berlin,System Design,Design logging ingestion at 10M events/sec.,Help me practice for Security Engineer interviews at Twitter located in Berlin. ||| Security Engineer ||| Twitter ||| Berlin ||| Design logging ingestion at 10M events/sec.,Help me practice for Security Engineer interviews at Twitter located in Berlin. ||| Security Engineer ||| Twitter ||| Berlin ||| Design logging ingestion at 10M events/sec.
1204,Give me common interview problems for SRE roles at Amazon in Toronto.,SRE,Amazon,Toronto,Behavioral/HR,Tell me about a project where you had to learn something quickly.,Give me common interview problems for SRE roles at Amazon in Toronto. ||| SRE ||| Amazon ||| Toronto ||| Tell me about a project where you had to learn something quickly.,Give me common interview problems for SRE roles at Amazon in Toronto. ||| SRE ||| Amazon ||| Toronto ||| Tell me about a project where you had to learn something quickly.
221,I have an interview for Data Engineer at Amazon in Munich — what mock questions should I expect?,Data Engineer,Amazon,Munich,OA,"Given a string, return length of longest substring without repeating characters.","I have an interview for Data Engineer at Amazon in Munich — what mock questions should I expect? ||| Data Engineer ||| Amazon ||| Munich ||| Given a string, return length of longest substring without repeating characters.","I have an interview for Data Engineer at Amazon in Munich — what mock questions should I expect? ||| Data Engineer ||| Amazon ||| Munich ||| Given a string, return length of longest substring without repeating characters."
718,I have an interview for Software Engineer at Twitter in Hyderabad — what mock questions should I expect?,Software Engineer,Twitter,Hyderabad,Technical,Serialize and deserialize a binary tree.,I have an interview for Software Engineer at Twitter in Hyderabad — what mock questions should I expect? ||| Software Engineer ||| Twitter ||| Hyderabad ||| Serialize and deserialize a binary tree.,I have an interview for Software Engineer at Twitter in Hyderabad — what mock questions should I expect? ||| Software Engineer ||| Twitter ||| Hyderabad ||| Serialize and deserialize a binary tree.
91,I'm preparing for a ML Engineer interview at Apple in Toronto. Can you give mock questions?,ML Engineer,Apple,Toronto,OA,Count islands in a binary matrix using DFS/BFS.,I'm preparing for a ML Engineer interview at Apple in Toronto. Can you give mock questions? ||| ML Engineer ||| Apple ||| Toronto ||| Count islands in a binary matrix using DFS/BFS.,I'm preparing for a ML Engineer interview at Apple in Toronto. Can you give mock questions? ||| ML Engineer ||| Apple ||| Toronto ||| Count islands in a binary matrix using DFS/BFS.
557,Give me common interview problems for Product Manager roles at Stripe in Paris.,Product Manager,Stripe,Paris,Technical,Implement an LRU cache with O(1) operations.,Give me common interview problems for Product Manager roles at Stripe in Paris. ||| Product Manager ||| Stripe ||| Paris ||| Implement an LRU cache with O(1) operations.,Give me common interview problems for Product Manager roles at Stripe in Paris. ||| Product Manager ||| Stripe ||| Paris ||| Implement an LRU cache with O(1) operations.
1246,I'm preparing for a Data Engineer interview at Dropbox in London. Can you give mock questions?,Data Engineer,Dropbox,London,Behavioral/HR,Tell me about a project where you had to learn something quickly.,I'm preparing for a Data Engineer interview at Dropbox in London. Can you give mock questions? ||| Data Engineer ||| Dropbox ||| London ||| Tell me about a project where you had to learn something quickly.,I'm preparing for a Data Engineer interview at Dropbox in London. Can you give mock questions? ||| Data Engineer ||| Dropbox ||| London ||| Tell me about a project where you had to learn something quickly.
1712,What should I study for a Frontend Engineer position at Stripe (location: Seattle)?,Frontend Engineer,Stripe,Seattle,ML Case Study,Propose an evaluation plan for a recommendation model with cold-start users.,What should I study for a Frontend Engineer position at Stripe (location: Seattle)? ||| Frontend Engineer ||| Stripe ||| Seattle ||| Propose an evaluation plan for a recommendation model with cold-start users.,What should I study for a Frontend Engineer position at Stripe (location: Seattle)? ||| Frontend Engineer ||| Stripe ||| Seattle ||| Propose an evaluation plan for a recommendation model with cold-start users.
1412,I have an interview for Security Engineer at Pinterest in Munich — what mock questions should I expect?,Security Engineer,Pinterest,Munich,Behavioral/HR,Describe a conflict with a teammate and how you resolved it.,I have an interview for Security Engineer at Pinterest in Munich — what mock questions should I expect? ||| Security Engineer ||| Pinterest ||| Munich ||| Describe a conflict with a teammate and how you resolved it.,I have an interview for Security Engineer at Pinterest in Munich — what mock questions should I expect? ||| Security Engineer ||| Pinterest ||| Munich ||| Describe a conflict with a teammate and how you resolved it.
