id,user_query,job_role,company,location,interview_round,mock_question,text,__text__
868,I have an interview for Backend Engineer at Amazon in Sydney — what mock questions should I expect?,Backend Engineer,Amazon,Sydney,System Design,Design a messaging queue with at-least-once delivery.,I have an interview for Backend Engineer at Amazon in Sydney — what mock questions should I expect? ||| Backend Engineer ||| Amazon ||| Sydney ||| Design a messaging queue with at-least-once delivery.,I have an interview for Backend Engineer at Amazon in Sydney — what mock questions should I expect? ||| Backend Engineer ||| Amazon ||| Sydney ||| Design a messaging queue with at-least-once delivery.
290,What should I study for a Frontend Engineer position at Apple (location: NYC)?,Frontend Engineer,Apple,NYC,OA,Implement two-sum with optimal complexity.,What should I study for a Frontend Engineer position at Apple (location: NYC)? ||| Frontend Engineer ||| Apple ||| NYC ||| Implement two-sum with optimal complexity.,What should I study for a Frontend Engineer position at Apple (location: NYC)? ||| Frontend Engineer ||| Apple ||| NYC ||| Implement two-sum with optimal complexity.
259,I'm preparing for a Frontend Engineer interview at LinkedIn in Boston. Can you give mock questions?,Frontend Engineer,LinkedIn,Boston,OA,Compute running median from a data stream.,I'm preparing for a Frontend Engineer interview at LinkedIn in Boston. Can you give mock questions? ||| Frontend Engineer ||| LinkedIn ||| Boston ||| Compute running median from a data stream.,I'm preparing for a Frontend Engineer interview at LinkedIn in Boston. Can you give mock questions? ||| Frontend Engineer ||| LinkedIn ||| Boston ||| Compute running median from a data stream.
1383,Give me common interview problems for Data Scientist roles at Adobe in Hyderabad.,Data Scientist,Adobe,Hyderabad,Behavioral/HR,Describe a time you failed and what you learned.,Give me common interview problems for Data Scientist roles at Adobe in Hyderabad. ||| Data Scientist ||| Adobe ||| Hyderabad ||| Describe a time you failed and what you learned.,Give me common interview problems for Data Scientist roles at Adobe in Hyderabad. ||| Data Scientist ||| Adobe ||| Hyderabad ||| Describe a time you failed and what you learned.
1794,I have an interview for Data Engineer at Apple in Chicago — what mock questions should I expect?,Data Engineer,Apple,Chicago,ML Case Study,How would you detect data drift and trigger model retraining?,I have an interview for Data Engineer at Apple in Chicago — what mock questions should I expect? ||| Data Engineer ||| Apple ||| Chicago ||| How would you detect data drift and trigger model retraining?,I have an interview for Data Engineer at Apple in Chicago — what mock questions should I expect? ||| Data Engineer ||| Apple ||| Chicago ||| How would you detect data drift and trigger model retraining?
106,Give me common interview problems for ML Engineer roles at Intuit in Berlin.,ML Engineer,Intuit,Berlin,OA,Compute running median from a data stream.,Give me common interview problems for ML Engineer roles at Intuit in Berlin. ||| ML Engineer ||| Intuit ||| Berlin ||| Compute running median from a data stream.,Give me common interview problems for ML Engineer roles at Intuit in Berlin. ||| ML Engineer ||| Intuit ||| Berlin ||| Compute running median from a data stream.
833,I have an interview for Data Engineer at Uber in Dublin — what mock questions should I expect?,Data Engineer,Uber,Dublin,System Design,Design a recommendation system for short video feed.,I have an interview for Data Engineer at Uber in Dublin — what mock questions should I expect? ||| Data Engineer ||| Uber ||| Dublin ||| Design a recommendation system for short video feed.,I have an interview for Data Engineer at Uber in Dublin — what mock questions should I expect? ||| Data Engineer ||| Uber ||| Dublin ||| Design a recommendation system for short video feed.
1577,Help me practice for QA Engineer interviews at Apple located in Singapore.,QA Engineer,Apple,Singapore,Behavioral/HR,Tell me about a time you handled an ambiguous requirement.,Help me practice for QA Engineer interviews at Apple located in Singapore. ||| QA Engineer ||| Apple ||| Singapore ||| Tell me about a time you handled an ambiguous requirement.,Help me practice for QA Engineer interviews at Apple located in Singapore. ||| QA Engineer ||| Apple ||| Singapore ||| Tell me about a time you handled an ambiguous requirement.
1859,Give me common interview problems for SRE roles at Salesforce in Boston.,SRE,Salesforce,Boston,ML Case Study,Design an offline/online training pipeline for user embeddings.,Give me common interview problems for SRE roles at Salesforce in Boston. ||| SRE ||| Salesforce ||| Boston ||| Design an offline/online training pipeline for user embeddings.,Give me common interview problems for SRE roles at Salesforce in Boston. ||| SRE ||| Salesforce ||| Boston ||| Design an offline/online training pipeline for user embeddings.
169,Give me common interview problems for SRE roles at Airbnb in Toronto.,SRE,Airbnb,Toronto,OA,Count islands in a binary matrix using DFS/BFS.,Give me common interview problems for SRE roles at Airbnb in Toronto. ||| SRE ||| Airbnb ||| Toronto ||| Count islands in a binary matrix using DFS/BFS.,Give me common interview problems for SRE roles at Airbnb in Toronto. ||| SRE ||| Airbnb ||| Toronto ||| Count islands in a binary matrix using DFS/BFS.
1107,Help me practice for ML Engineer interviews at Amazon located in Vancouver.,ML Engineer,Amazon,Vancouver,System Design,Design a scalable feature store for ML training/inference.,Help me practice for ML Engineer interviews at Amazon located in Vancouver. ||| ML Engineer ||| Amazon ||| Vancouver ||| Design a scalable feature store for ML training/inference.,Help me practice for ML Engineer interviews at Amazon located in Vancouver. ||| ML Engineer ||| Amazon ||| Vancouver ||| Design a scalable feature store for ML training/inference.
1299,I have an interview for Product Manager at Snap in Chicago — what mock questions should I expect?,Product Manager,Snap,Chicago,Behavioral/HR,Describe a conflict with a teammate and how you resolved it.,I have an interview for Product Manager at Snap in Chicago — what mock questions should I expect? ||| Product Manager ||| Snap ||| Chicago ||| Describe a conflict with a teammate and how you resolved it.,I have an interview for Product Manager at Snap in Chicago — what mock questions should I expect? ||| Product Manager ||| Snap ||| Chicago ||| Describe a conflict with a teammate and how you resolved it.
202,Give me common interview problems for Frontend Engineer roles at Pinterest in Toronto.,Frontend Engineer,Pinterest,Toronto,OA,Compute running median from a data stream.,Give me common interview problems for Frontend Engineer roles at Pinterest in Toronto. ||| Frontend Engineer ||| Pinterest ||| Toronto ||| Compute running median from a data stream.,Give me common interview problems for Frontend Engineer roles at Pinterest in Toronto. ||| Frontend Engineer ||| Pinterest ||| Toronto ||| Compute running median from a data stream.
1430,Give me common interview problems for Frontend Engineer roles at Twitter in Munich.,Frontend Engineer,Twitter,Munich,Behavioral/HR,Describe a conflict with a teammate and how you resolved it.,Give me common interview problems for Frontend Engineer roles at Twitter in Munich. ||| Frontend Engineer ||| Twitter ||| Munich ||| Describe a conflict with a teammate and how you resolved it.,Give me common interview problems for Frontend Engineer roles at Twitter in Munich. ||| Frontend Engineer ||| Twitter ||| Munich ||| Describe a conflict with a teammate and how you resolved it.
789,I have an interview for ML Engineer at Meta in Bangalore — what mock questions should I expect?,ML Engineer,Meta,Bangalore,Technical,Find the longest consecutive sequence length.,I have an interview for ML Engineer at Meta in Bangalore — what mock questions should I expect? ||| ML Engineer ||| Meta ||| Bangalore ||| Find the longest consecutive sequence length.,I have an interview for ML Engineer at Meta in Bangalore — what mock questions should I expect? ||| ML Engineer ||| Meta ||| Bangalore ||| Find the longest consecutive sequence length.
1443,Help me practice for Frontend Engineer interviews at Stripe located in Munich.,Frontend Engineer,Stripe,Munich,Behavioral/HR,Describe a conflict with a teammate and how you resolved it.,Help me practice for Frontend Engineer interviews at Stripe located in Munich. ||| Frontend Engineer ||| Stripe ||| Munich ||| Describe a conflict with a teammate and how you resolved it.,Help me practice for Frontend Engineer interviews at Stripe located in Munich. ||| Frontend Engineer ||| Stripe ||| Munich ||| Describe a conflict with a teammate and how you resolved it.
103,Give me common interview problems for ML Engineer roles at Microsoft in Austin.,ML Engineer,Microsoft,Austin,OA,Count islands in a binary matrix using DFS/BFS.,Give me common interview problems for ML Engineer roles at Microsoft in Austin. ||| ML Engineer ||| Microsoft ||| Austin ||| Count islands in a binary matrix using DFS/BFS.,Give me common interview problems for ML Engineer roles at Microsoft in Austin. ||| ML Engineer ||| Microsoft ||| Austin ||| Count islands in a binary matrix using DFS/BFS.
418,I'm preparing for a Frontend Engineer interview at Twitter in NYC. Can you give mock questions?,Frontend Engineer,Twitter,NYC,Technical,Implement an LRU cache with O(1) operations.,I'm preparing for a Frontend Engineer interview at Twitter in NYC. Can you give mock questions? ||| Frontend Engineer ||| Twitter ||| NYC ||| Implement an LRU cache with O(1) operations.,I'm preparing for a Frontend Engineer interview at Twitter in NYC. Can you give mock questions? ||| Frontend Engineer ||| Twitter ||| NYC ||| Implement an LRU cache with O(1) operations.
1704,Help me practice for SRE interviews at Uber located in Bay Area.,SRE,Uber,Bay Area,ML Case Study,How would you detect data drift and trigger model retraining?,Help me practice for SRE interviews at Uber located in Bay Area. ||| SRE ||| Uber ||| Bay Area ||| How would you detect data drift and trigger model retraining?,Help me practice for SRE interviews at Uber located in Bay Area. ||| SRE ||| Uber ||| Bay Area ||| How would you detect data drift and trigger model retraining?
351,I have an interview for ML Engineer at Pinterest in Bangalore — what mock questions should I expect?,ML Engineer,Pinterest,Bangalore,OA,Count islands in a binary matrix using DFS/BFS.,I have an interview for ML Engineer at Pinterest in Bangalore — what mock questions should I expect? ||| ML Engineer ||| Pinterest ||| Bangalore ||| Count islands in a binary matrix using DFS/BFS.,I have an interview for ML Engineer at Pinterest in Bangalore — what mock questions should I expect? ||| ML Engineer ||| Pinterest ||| Bangalore ||| Count islands in a binary matrix using DFS/BFS.
788,Help me practice for Backend Engineer interviews at Salesforce located in Boston.,Backend Engineer,Salesforce,Boston,Technical,Design a rate limiter supporting sliding window semantics.,Help me practice for Backend Engineer interviews at Salesforce located in Boston. ||| Backend Engineer ||| Salesforce ||| Boston ||| Design a rate limiter supporting sliding window semantics.,Help me practice for Backend Engineer interviews at Salesforce located in Boston. ||| Backend Engineer ||| Salesforce ||| Boston ||| Design a rate limiter supporting sliding window semantics.
1480,Give me common interview problems for Data Scientist roles at Twitter in Dublin.,Data Scientist,Twitter,Dublin,Behavioral/HR,Describe a conflict with a teammate and how you resolved it.,Give me common interview problems for Data Scientist roles at Twitter in Dublin. ||| Data Scientist ||| Twitter ||| Dublin ||| Describe a conflict with a teammate and how you resolved it.,Give me common interview problems for Data Scientist roles at Twitter in Dublin. ||| Data Scientist ||| Twitter ||| Dublin ||| Describe a conflict with a teammate and how you resolved it.
1682,I'm preparing for a Backend Engineer interview at LinkedIn in Boston. Can you give mock questions?,Backend Engineer,LinkedIn,Boston,ML Case Study,How would you detect data drift and trigger model retraining?,I'm preparing for a Backend Engineer interview at LinkedIn in Boston. Can you give mock questions? ||| Backend Engineer ||| LinkedIn ||| Boston ||| How would you detect data drift and trigger model retraining?,I'm preparing for a Backend Engineer interview at LinkedIn in Boston. Can you give mock questions? ||| Backend Engineer ||| LinkedIn ||| Boston ||| How would you detect data drift and trigger model retraining?
1467,Give me common interview problems for Software Engineer roles at Google in London.,Software Engineer,Google,London,Behavioral/HR,Describe a time you failed and what you learned.,Give me common interview problems for Software Engineer roles at Google in London. ||| Software Engineer ||| Google ||| London ||| Describe a time you failed and what you learned.,Give me common interview problems for Software Engineer roles at Google in London. ||| Software Engineer ||| Google ||| London ||| Describe a time you failed and what you learned.
1125,I have an interview for Backend Engineer at Pinterest in Paris — what mock questions should I expect?,Backend Engineer,Pinterest,Paris,System Design,Design a recommendation system for short video feed.,I have an interview for Backend Engineer at Pinterest in Paris — what mock questions should I expect? ||| Backend Engineer ||| Pinterest ||| Paris ||| Design a recommendation system for short video feed.,I have an interview for Backend Engineer at Pinterest in Paris — what mock questions should I expect? ||| Backend Engineer ||| Pinterest ||| Paris ||| Design a recommendation system for short video feed.
1420,I'm preparing for a Frontend Engineer interview at Netflix in Melbourne. Can you give mock questions?,Frontend Engineer,Netflix,Melbourne,Behavioral/HR,Describe a time you failed and what you learned.,I'm preparing for a Frontend Engineer interview at Netflix in Melbourne. Can you give mock questions? ||| Frontend Engineer ||| Netflix ||| Melbourne ||| Describe a time you failed and what you learned.,I'm preparing for a Frontend Engineer interview at Netflix in Melbourne. Can you give mock questions? ||| Frontend Engineer ||| Netflix ||| Melbourne ||| Describe a time you failed and what you learned.
1230,I'm preparing for a Security Engineer interview at Reddit in Berlin. Can you give mock questions?,Security Engineer,Reddit,Berlin,Behavioral/HR,Tell me about a time you handled an ambiguous requirement.,I'm preparing for a Security Engineer interview at Reddit in Berlin. Can you give mock questions? ||| Security Engineer ||| Reddit ||| Berlin ||| Tell me about a time you handled an ambiguous requirement.,I'm preparing for a Security Engineer interview at Reddit in Berlin. Can you give mock questions? ||| Security Engineer ||| Reddit ||| Berlin ||| Tell me about a time you handled an ambiguous requirement.
841,Give me common interview problems for Security Engineer roles at Netflix in Bay Area.,Security Engineer,Netflix,Bay Area,System Design,Design a globally distributed URL shortener.,Give me common interview problems for Security Engineer roles at Netflix in Bay Area. ||| Security Engineer ||| Netflix ||| Bay Area ||| Design a globally distributed URL shortener.,Give me common interview problems for Security Engineer roles at Netflix in Bay Area. ||| Security Engineer ||| Netflix ||| Bay Area ||| Design a globally distributed URL shortener.
1448,What should I study for a SRE position at Pinterest (location: Sydney)?,SRE,Pinterest,Sydney,Behavioral/HR,Describe a time you failed and what you learned.,What should I study for a SRE position at Pinterest (location: Sydney)? ||| SRE ||| Pinterest ||| Sydney ||| Describe a time you failed and what you learned.,What should I study for a SRE position at Pinterest (location: Sydney)? ||| SRE ||| Pinterest ||| Sydney ||| Describe a time you failed and what you learned.
1304,I'm preparing for a Frontend Engineer interview at Dropbox in Bangalore. Can you give mock questions?,Frontend Engineer,Dropbox,Bangalore,Behavioral/HR,Tell me about a time you handled an ambiguous requirement.,I'm preparing for a Frontend Engineer interview at Dropbox in Bangalore. Can you give mock questions? ||| Frontend Engineer ||| Dropbox ||| Bangalore ||| Tell me about a time you handled an ambiguous requirement.,I'm preparing for a Frontend Engineer interview at Dropbox in Bangalore. Can you give mock questions? ||| Frontend Engineer ||| Dropbox ||| Bangalore ||| Tell me about a time you handled an ambiguous requirement.
1830,Give me common interview problems for Data Engineer roles at Twitter in Singapore.,Data Engineer,Twitter,Singapore,ML Case Study,How would you detect data drift and trigger model retraining?,Give me common interview problems for Data Engineer roles at Twitter in Singapore. ||| Data Engineer ||| Twitter ||| Singapore ||| How would you detect data drift and trigger model retraining?,Give me common interview problems for Data Engineer roles at Twitter in Singapore. ||| Data Engineer ||| Twitter ||| Singapore ||| How would you detect data drift and trigger model retraining?
704,I'm preparing for a Backend Engineer interview at Pinterest in Melbourne. Can you give mock questions?,Backend Engineer,Pinterest,Melbourne,Technical,Serialize and deserialize a binary tree.,I'm preparing for a Backend Engineer interview at Pinterest in Melbourne. Can you give mock questions? ||| Backend Engineer ||| Pinterest ||| Melbourne ||| Serialize and deserialize a binary tree.,I'm preparing for a Backend Engineer interview at Pinterest in Melbourne. Can you give mock questions? ||| Backend Engineer ||| Pinterest ||| Melbourne ||| Serialize and deserialize a binary tree.
1554,Help me practice for Product Manager interviews at Google located in Bangalore.,Product Manager,Google,Bangalore,Behavioral/HR,Tell me about a time you handled an ambiguous requirement.,Help me practice for Product Manager interviews at Google located in Bangalore. ||| Product Manager ||| Google ||| Bangalore ||| Tell me about a time you handled an ambiguous requirement.,Help me practice for Product Manager interviews at Google located in Bangalore. ||| Product Manager ||| Google ||| Bangalore ||| Tell me about a time you handled an ambiguous requirement.
470,I'm preparing for a ML Engineer interview at Adobe in Toronto. Can you give mock questions?,ML Engineer,Adobe,Toronto,Technical,Find the longest consecutive sequence length.,I'm preparing for a ML Engineer interview at Adobe in Toronto. Can you give mock questions? ||| ML Engineer ||| Adobe ||| Toronto ||| Find the longest consecutive sequence length.,I'm preparing for a ML Engineer interview at Adobe in Toronto. Can you give mock questions? ||| ML Engineer ||| Adobe ||| Toronto ||| Find the longest consecutive sequence length.
942,I have an interview for Backend Engineer at Twitter in Austin — what mock questions should I expect?,Backend Engineer,Twitter,Austin,System Design,Design logging ingestion at 10M events/sec.,I have an interview for Backend Engineer at Twitter in Austin — what mock questions should I expect? ||| Backend Engineer ||| Twitter ||| Austin ||| Design logging ingestion at 10M events/sec.,I have an interview for Backend Engineer at Twitter in Austin — what mock questions should I expect? ||| Backend Engineer ||| Twitter ||| Austin ||| Design logging ingestion at 10M events/sec.
1642,What should I study for a Backend Engineer position at Airbnb (location: LA)?,Backend Engineer,Airbnb,LA,ML Case Study,Design an offline/online training pipeline for user embeddings.,What should I study for a Backend Engineer position at Airbnb (location: LA)? ||| Backend Engineer ||| Airbnb ||| LA ||| Design an offline/online training pipeline for user embeddings.,What should I study for a Backend Engineer position at Airbnb (location: LA)? ||| Backend Engineer ||| Airbnb ||| LA ||| Design an offline/online training pipeline for user embeddings.
76,What should I study for a SRE position at Pinterest (location: Bay Area)?,SRE,Pinterest,Bay Area,OA,"Given a string, return length of longest substring without repeating characters.","What should I study for a SRE position at Pinterest (location: Bay Area)? ||| SRE ||| Pinterest ||| Bay Area ||| Given a string, return length of longest substring without repeating characters.","What should I study for a SRE position at Pinterest (location: Bay Area)? ||| SRE ||| Pinterest ||| Bay Area ||| Given a string, return length of longest substring without repeating characters."
1749,Help me practice for Security Engineer interviews at Apple located in Berlin.,Security Engineer,Apple,Berlin,ML Case Study,Design an offline/online training pipeline for user embeddings.,Help me practice for Security Engineer interviews at Apple located in Berlin. ||| Security Engineer ||| Apple ||| Berlin ||| Design an offline/online training pipeline for user embeddings.,Help me practice for Security Engineer interviews at Apple located in Berlin. ||| Security Engineer ||| Apple ||| Berlin ||| Design an offline/online training pipeline for user embeddings.
825,Help me practice for ML Engineer interviews at Stripe located in Singapore.,ML Engineer,Stripe,Singapore,System Design,Design a scalable feature store for ML training/inference.,Help me practice for ML Engineer interviews at Stripe located in Singapore. ||| ML Engineer ||| Stripe ||| Singapore ||| Design a scalable feature store for ML training/inference.,Help me practice for ML Engineer interviews at Stripe located in Singapore. ||| ML Engineer ||| Stripe ||| Singapore ||| Design a scalable feature store for ML training/inference.
271,I have an interview for Security Engineer at Amazon in Munich — what mock questions should I expect?,Security Engineer,Amazon,Munich,OA,Implement two-sum with optimal complexity.,I have an interview for Security Engineer at Amazon in Munich — what mock questions should I expect? ||| Security Engineer ||| Amazon ||| Munich ||| Implement two-sum with optimal complexity.,I have an interview for Security Engineer at Amazon in Munich — what mock questions should I expect? ||| Security Engineer ||| Amazon ||| Munich ||| Implement two-sum with optimal complexity.
827,Give me common interview problems for QA Engineer roles at Uber in Remote.,QA Engineer,Uber,Remote,System Design,Design a monitoring/alerting system for microservices.,Give me common interview problems for QA Engineer roles at Uber in Remote. ||| QA Engineer ||| Uber ||| Remote ||| Design a monitoring/alerting system for microservices.,Give me common interview problems for QA Engineer roles at Uber in Remote. ||| QA Engineer ||| Uber ||| Remote ||| Design a monitoring/alerting system for microservices.
1691,Help me practice for Data Engineer interviews at Dropbox located in Remote.,Data Engineer,Dropbox,Remote,ML Case Study,How to measure fairness and bias in a loan prediction model?,Help me practice for Data Engineer interviews at Dropbox located in Remote. ||| Data Engineer ||| Dropbox ||| Remote ||| How to measure fairness and bias in a loan prediction model?,Help me practice for Data Engineer interviews at Dropbox located in Remote. ||| Data Engineer ||| Dropbox ||| Remote ||| How to measure fairness and bias in a loan prediction model?
784,I'm preparing for a ML Engineer interview at Airbnb in Dublin. Can you give mock questions?,ML Engineer,Airbnb,Dublin,Technical,Implement an LRU cache with O(1) operations.,I'm preparing for a ML Engineer interview at Airbnb in Dublin. Can you give mock questions? ||| ML Engineer ||| Airbnb ||| Dublin ||| Implement an LRU cache with O(1) operations.,I'm preparing for a ML Engineer interview at Airbnb in Dublin. Can you give mock questions? ||| ML Engineer ||| Airbnb ||| Dublin ||| Implement an LRU cache with O(1) operations.
1705,What should I study for a Software Engineer position at Intuit (location: Munich)?,Software Engineer,Intuit,Munich,ML Case Study,How would you detect data drift and trigger model retraining?,What should I study for a Software Engineer position at Intuit (location: Munich)? ||| Software Engineer ||| Intuit ||| Munich ||| How would you detect data drift and trigger model retraining?,What should I study for a Software Engineer position at Intuit (location: Munich)? ||| Software Engineer ||| Intuit ||| Munich ||| How would you detect data drift and trigger model retraining?
1218,Give me common interview problems for Security Engineer roles at Meta in Berlin.,Security Engineer,Meta,Berlin,Behavioral/HR,Tell me about a project where you had to learn something quickly.,Give me common interview problems for Security Engineer roles at Meta in Berlin. ||| Security Engineer ||| Meta ||| Berlin ||| Tell me about a project where you had to learn something quickly.,Give me common interview problems for Security Engineer roles at Meta in Berlin. ||| Security Engineer ||| Meta ||| Berlin ||| Tell me about a project where you had to learn something quickly.
990,Help me practice for QA Engineer interviews at Stripe located in NYC.,QA Engineer,Stripe,NYC,System Design,Design a real-time ride-hailing dispatch system.,Help me practice for QA Engineer interviews at Stripe located in NYC. ||| QA Engineer ||| Stripe ||| NYC ||| Design a real-time ride-hailing dispatch system.,Help me practice for QA Engineer interviews at Stripe located in NYC. ||| QA Engineer ||| Stripe ||| NYC ||| Design a real-time ride-hailing dispatch system.
